{
  "protocolVersion": "0.1",
  "ownerId": "owner_server_01",
  "projectionName": "responsibility.summary",
  "snapshotId": "snapshot_01",
  "snapshotBaseCursor": 0,
  "fromExclusiveCursor": 0,
  "highWaterCursor": 2,
  "nextCursor": 2,
  "items": [
    {
      "cursor": 1,
      "itemType": "outcome",
      "aggregateId": "outcome_01",
      "outcomeId": "outcome_01",
      "revision": 1,
      "state": "captured",
      "userStatement": "Make sure the reviewed update is handled.",
      "createdAt": "2026-08-05T12:00:01Z"
    },
    {
      "cursor": 2,
      "itemType": "work_unit",
      "aggregateId": "work_unit_01",
      "outcomeId": "outcome_01",
      "missionId": null,
      "position": 0,
      "revision": 1,
      "state": "proposed",
      "responsibility": "Prepare the reviewed update.",
      "createdAt": "2026-08-05T12:00:01Z"
    }
  ],
  "hasMore": false,
  "generatedAt": "2026-08-05T12:06:00Z"
}
